StartDate,EndDate,Status,IPAddress,Progress,Duration (in seconds),Finished,RecordedDate,ResponseId,RecipientLastName,RecipientFirstName,RecipientEmail,ExternalReference,LocationLatitude,LocationLongitude,DistributionChannel,UserLanguage,Q1.2,Q1.3,Q2.1_1,Q2.1_2,Q2.1_3,Q2.3,Q2.4_1,Q2.4_2,Q2.5,Q3.2,Q3.3,Q3.4,Q3.5,Q3.6,Q3.7,Q3.8,Q3.9,Q3.9_4_TEXT,Q3.10,Q3.11,mTurkCode,crackdown,issue,funding
2018-03-22 17:35:22,2018-03-22 17:40:36,IP Address,71.202.159.133,100,314,True,2018-03-22 17:40:37,R_2v0p4ju2Q4DCDxP,,,,,37.906295776367,-122.06500244141,anonymous,EN,Yes,"Green,Yellow",Favorable,Neutral,Unfavorable,Extremely unlikely,0,100,"I would never donate to an organization without researching it thoroughly. The 100 that I keep will be later donated to an organization that I know I can support.  ",Once every three months,No,Most of the time,"Independent, leaning liberal",Graduate or professional degree,Never,Blue,Male,,"$70,000 – $79,999",65 – 74,276872,.,human rights for refugees,"individual, private donors"
2018-03-22 17:38:57,2018-03-22 17:41:45,IP Address,173.31.67.83,100,168,True,2018-03-22 17:41:46,R_1gd5je3tNe1gI5U,,,,,32.544296264648,-84.920799255371,anonymous,EN,Yes,"Green,Yellow",Very favorable,Favorable,Favorable,Neither likely nor unlikely,15,85,I am not sure how they accomplish their goals.,Once every three months,No,Most of the time,"Independent, leaning liberal",2 year degree,Once a week,Blue,Male,,"$70,000 – $79,999",25 – 34,4009954,&nbsp;and works in countries that have recently passed laws that harshly restrict nonprofit organizations.,human rights for refugees,"individual, private donors"
2018-03-22 17:38:22,2018-03-22 17:42:23,IP Address,71.176.197.47,100,240,True,2018-03-22 17:42:27,R_1i2JRmvI0qR7MU2,,,,,37.580902099609,-77.415298461914,anonymous,EN,Yes,"Green,Yellow",Very favorable,Favorable,Very favorable,Extremely unlikely,0,100,I WOULD NOT DONATE TO THIS ORGANIZATION,Once every three months,Yes,Most of the time,Very conservative,2 year degree,Once or twice a month,Blue,Female,,"$60,000 – $69,999",35 – 44,8400541,.,humanitarian assistance for refugees,government donors
2018-03-22 17:40:25,2018-03-22 17:42:39,IP Address,72.196.210.193,100,133,True,2018-03-22 17:42:40,R_3lzQUxky5oWfBAQ,,,,,38.759094238281,-77.095100402832,anonymous,EN,Yes,"Green,Yellow",Very favorable,Very favorable,Very favorable,Somewhat likely,50,50,It feels fair to share half,Once a month,Yes,Most of the time,"Independent, leaning liberal",4 year degree,Never,Blue,Female,,"$80,000 – $89,999",55 – 64,2492385,.,human rights for refugees,government donors
2018-03-22 17:40:27,2018-03-22 17:42:53,IP Address,24.26.33.188,100,145,True,2018-03-22 17:42:53,R_28G1ea2pOfrqZzU,,,,,37.99690246582,-84.746597290039,anonymous,EN,Yes,"Green,Yellow",Very favorable,Favorable,Very favorable,Somewhat unlikely,5,95,"I don't know much about IRC, so I would donate a minimal amount. I also donate to other causes.",Once a month,Yes,Most of the time,"Independent, leaning conservative",4 year degree,Once or twice a month,Blue,Male,,"$20,000 – $29,999",45 – 54,9713731,.,humanitarian assistance for refugees,"individual, private donors"
2018-03-22 17:40:44,2018-03-22 17:43:42,IP Address,67.206.207.1,100,178,True,2018-03-22 17:43:43,R_ThX4j0UwdgCsBNL,,,,,18.095993041992,-66.350799560547,anonymous,EN,Yes,"Green,Yellow",Very favorable,Very favorable,Very favorable,Somewhat likely,10,90,"I donate 10 percent because this is a good nonprofit organization and keep the rest to pay my debts. ",Once every three months,Yes,Only now and then,Independent,4 year degree,Once or twice a month,Blue,Female,,"$30,000 – $39,999",25 – 34,3839990,&nbsp;and works in countries that have recently passed laws that harshly restrict nonprofit organizations.,humanitarian assistance for refugees,"individual, private donors"
2018-03-22 17:45:58,2018-03-22 17:48:44,IP Address,174.16.197.5,100,165,True,2018-03-22 17:48:44,R_3FPV5J3GkY2I57J,,,,,39.771301269531,-105.04989624023,anonymous,EN,Yes,"Green,Yellow",Very favorable,Very favorable,Very favorable,Extremely likely,100,0,I like donating to nonprofit organizations,Once a month,Yes,Most of the time,Strong liberal,4 year degree,Once a week,Blue,Male,,"$50,000 – $59,999",25 – 34,5995334,&nbsp;and works in countries that have recently passed laws that harshly restrict nonprofit organizations.,humanitarian assistance for refugees,government donors
2018-03-22 17:50:19,2018-03-22 17:51:30,IP Address,75.24.43.4,100,71,True,2018-03-22 17:51:31,R_3NRkuiVlPlamZ8p,,,,,36.755996704102,-119.81739807129,anonymous,EN,Yes,"Green,Yellow",Very favorable,Very favorable,Very favorable,Extremely likely,80,20,"I need money for groceries, but they could have the rest.",Once a month,Yes,Some of the time,Strong liberal,Graduate or professional degree,Once or twice a month,Blue,Female,,"$80,000 – $89,999",35 – 44,7445152,&nbsp;and works in countries that have recently passed laws that harshly restrict nonprofit organizations.,human rights for refugees,government donors
2018-03-22 17:48:25,2018-03-22 17:52:46,IP Address,66.214.20.231,100,261,True,2018-03-22 17:52:47,R_3j0AsLkFBTVLa4z,,,,,33.754196166992,-118.20190429688,anonymous,EN,Yes,"Green,Yellow",Favorable,Favorable,Favorable,Extremely unlikely,0,100,I would take the 100 and use it to better help myself,Once a year,Yes,Some of the time,"Independent, leaning liberal",Some college,Never,Blue,Male,,"$70,000 – $79,999",45 – 54,6487777,.,human rights for refugees,"individual, private donors"
2018-03-22 17:50:09,2018-03-22 17:53:09,IP Address,69.59.72.119,100,180,True,2018-03-22 17:53:10,R_2Yn2cb1nRw8ZQGx,,,,,37.403305053711,-119.61380004883,anonymous,EN,Yes,"Green,Yellow",Favorable,Favorable,Favorable,Neither likely nor unlikely,8,92,"That is how much I feel that I could reasonably afford to donate, as I really need the rest of the money at this time, being as I am struggling financially.",Once every few years,No,Some of the time,"Independent, leaning conservative",Some college,Never,Blue,Female,,"$20,000 – $29,999",55 – 64,3656433,.,humanitarian assistance for refugees,"individual, private donors"
2018-03-22 17:49:24,2018-03-22 17:53:12,IP Address,108.207.17.124,100,227,True,2018-03-22 17:53:13,R_1P7AJbLKkdS5wk1,,,,,38.706298828125,-90.668403625488,anonymous,EN,Yes,"Green,Yellow",Very favorable,Very favorable,Very favorable,Somewhat likely,80,20,"BECAUSE I AM BROKE RIGHT NOW SO I WOULD BE SURE TO SAVE A LITTLE OF MY EXTRA MONEY FOR A WEEK WHEN I DIDNT HAVE ANYTHING EXTRA TO SPEND. ",Once every three months,No,Most of the time,"Independent, leaning liberal",2 year degree,Never,Blue,Female,,"$80,000 – $89,999",35 – 44,8652735,.,humanitarian assistance for refugees,government donors
2018-03-22 17:51:19,2018-03-22 17:53:33,IP Address,98.109.47.124,100,133,True,2018-03-22 17:53:34,R_2wSIOn0F4r2V6Oj,,,,,40.424194335938,-74.552299499512,anonymous,EN,Yes,"Green,Yellow",Neutral,Neutral,Neutral,Extremely unlikely,1,99,"I do not trust any nonprofit organization, i rather spend my money and do the volunteering myself so i know the money is being used correctly and benefiting the less fortunate.",Once a week,Yes,Most of the time,Conservative,4 year degree,Once a week,Blue,Female,,Prefer not to say,35 – 44,2622632,&nbsp;and works in countries that have recently passed laws that harshly restrict nonprofit organizations.,humanitarian assistance for refugees,government donors
2018-03-22 17:52:10,2018-03-22 17:55:28,IP Address,173.244.48.138,100,198,True,2018-03-22 17:55:29,R_3OelLNEyyjCh4qd,,,,,34.052200317383,-118.24369812012,anonymous,EN,Yes,"Green,Yellow",Favorable,Favorable,Favorable,Somewhat likely,25,75,There is not enough information provided on the organization.,Once every three months,Yes,Most of the time,Liberal,Graduate or professional degree,Never,Blue,Female,,"$100,000 – $149,999",45 – 54,2021371,&nbsp;and works in countries that have recently passed laws that harshly restrict nonprofit organizations.,humanitarian assistance for refugees,"individual, private donors"
2018-03-22 17:51:45,2018-03-22 17:56:01,IP Address,69.14.144.49,100,255,True,2018-03-22 17:56:01,R_3noeda3sAmJTSnm,,,,,42.59880065918,-83.010398864746,anonymous,EN,Yes,"Green,Yellow",Very favorable,Favorable,Favorable,Somewhat likely,15,85,$15 seems like a reasonable amount. As far as the balance? I have expenses as do most...,Once every six months,Yes,Most of the time,Independent,4 year degree,Once or twice a month,Blue,Male,,"$90,000 – $99,999",45 – 54,4418717,.,human rights for refugees,"individual, private donors"
2018-03-22 17:54:07,2018-03-22 17:57:08,IP Address,107.128.41.217,100,181,True,2018-03-22 17:57:09,R_128SysCBvhChipL,,,,,34.137893676758,-118.1296005249,anonymous,EN,Yes,"Green,Yellow",Very favorable,Very favorable,Very favorable,Neither likely nor unlikely,5,95,I am not familiar with IRC and would like to find out more about the organization before donating a larger amount of money.,Once a month,No,Some of the time,Very conservative,Some college,A few times a year,Blue,Female,,"Less than $10,000",55 – 64,4350781,.,human rights for refugees,government donors
2018-03-22 17:54:46,2018-03-22 17:58:13,IP Address,65.78.174.111,100,206,True,2018-03-22 17:58:13,R_1LGyHLCQT2l7uuN,,,,,38.408798217773,-121.37159729004,anonymous,EN,Yes,"Green,Yellow",Very favorable,Favorable,Very favorable,Somewhat likely,29,71,I think there's too many refugees flooding into Europe and to a lesser extent America,Once a month,No,Most of the time,Conservative,4 year degree,A few times a year,Blue,Male,,"$90,000 – $99,999",55 – 64,7674871,&nbsp;and works in countries that have recently passed laws that harshly restrict nonprofit organizations.,human rights for refugees,"individual, private donors"
2018-03-22 17:57:59,2018-03-22 18:00:21,IP Address,24.252.112.190,100,141,True,2018-03-22 18:00:21,R_1GBV30RXiLCkzco,,,,,30.009994506836,-90.162803649902,anonymous,EN,Yes,"Green,Yellow",Favorable,Favorable,Favorable,Somewhat likely,20,80,I feel like $20 is an appropriate amount to help make a difference.,Once a year,Yes,Some of the time,"Independent, leaning liberal",4 year degree,Never,Blue,Female,,"$40,000 – $49,999",25 – 34,2361815,&nbsp;and works in countries that have recently passed laws that harshly restrict nonprofit organizations.,humanitarian assistance for refugees,government donors
2018-03-22 17:57:24,2018-03-22 18:00:30,IP Address,187.162.169.88,100,185,True,2018-03-22 18:00:30,R_3FJTmP8fmNYcXVo,,,,,19.434204101562,-99.138603210449,anonymous,EN,Yes,"Green,Yellow",Favorable,Favorable,Favorable,Somewhat unlikely,0,100,i rarely donate unless i'm involved with the organization and know deep down what they are doing,Once every three months,Yes,Only now and then,"Independent, leaning liberal",4 year degree,A few times a year,Blue,Female,,"$90,000 – $99,999",25 – 34,3223671,.,humanitarian assistance for refugees,government donors
2018-03-22 17:56:42,2018-03-22 18:00:58,IP Address,96.2.80.114,100,256,True,2018-03-22 18:00:59,R_1lbHQWi647bGzDE,,,,,43.595397949219,-96.701698303223,anonymous,EN,Yes,"Green,Yellow",Very favorable,Very favorable,Very favorable,Somewhat likely,100,0,I have a personal connection with someone involved in helping refugees.,Once a week,Yes,Only now and then,"Independent, leaning conservative",Some college,Once a week,Blue,Female,,"$70,000 – $79,999",35 – 44,7641207,.,human rights for refugees,government donors
2018-03-22 17:59:14,2018-03-22 18:01:56,IP Address,71.186.219.228,100,162,True,2018-03-22 18:01:57,R_3qq7EQGl1sKV7mV,,,,,42.976104736328,-78.872703552246,anonymous,EN,Yes,"Green,Yellow",Favorable,Favorable,Favorable,Neither likely nor unlikely,51,49,"i think it would be fair donating some and keeping some for myself ",Once a year,No,Some of the time,Independent,High school graduate,Seldom,Blue,Male,,"Less than $10,000",35 – 44,9577122,&nbsp;and works in countries that have recently passed laws that harshly restrict nonprofit organizations.,humanitarian assistance for refugees,"individual, private donors"
2018-03-22 18:00:26,2018-03-22 18:02:29,IP Address,68.199.96.18,100,123,True,2018-03-22 18:02:30,R_9zzsCObPHZ1aIKJ,,,,,40.815200805664,-73.362396240234,anonymous,EN,Yes,"Green,Yellow",Very favorable,Very favorable,Very favorable,Somewhat likely,20,80,Because it is generous but not spendthrifty,Once a week,Yes,Most of the time,Liberal,2 year degree,Seldom,Blue,Female,,"$10,000 – $19,999",35 – 44,885327,.,human rights for refugees,"individual, private donors"
2018-03-22 18:00:35,2018-03-22 18:03:14,IP Address,69.138.143.146,100,159,True,2018-03-22 18:03:15,R_sMQI1ciV4qYEtSp,,,,,26.665802001953,-81.748001098633,anonymous,EN,Yes,"Green,Yellow",Favorable,Favorable,Favorable,Somewhat unlikely,8,92,I would donate a small portion to help the organization but I would keep the rest for myself as I really need the money.,Once every few years,No,Most of the time,"Independent, leaning conservative",4 year degree,Once a week,Blue,Female,,"$40,000 – $49,999",25 – 34,4829462,&nbsp;and works in countries that have recently passed laws that harshly restrict nonprofit organizations.,human rights for refugees,"individual, private donors"
2018-03-22 18:02:32,2018-03-22 18:04:25,IP Address,68.102.115.211,100,112,True,2018-03-22 18:04:26,R_aUYp7KvDV3gkbeh,,,,,37.706802368164,-97.278701782227,anonymous,EN,Yes,"Green,Yellow",Very favorable,Very favorable,Very favorable,Somewhat likely,0,100,I need the money right now,Once every six months,Yes,Most of the time,"Independent, leaning liberal",4 year degree,A few times a year,Blue,Female,,"$80,000 – $89,999",25 – 34,5894375,.,humanitarian assistance for refugees,"individual, private donors"
2018-03-22 18:01:53,2018-03-22 18:05:04,IP Address,107.216.225.130,100,191,True,2018-03-22 18:05:05,R_27gogOKHtdwkr3O,,,,,38.494995117188,-121.53050231934,anonymous,EN,Yes,"Green,Yellow",Favorable,Favorable,Favorable,Extremely unlikely,0,100,There are other NGOs that I support who I donate.  I would keep the $100 and donate to another NGO whose cause is more important to me.,Once a month,No,Most of the time,"Independent, leaning conservative",Graduate or professional degree,Never,Blue,Male,,"$90,000 – $99,999",45 – 54,4260685,&nbsp;and works in countries that have recently passed laws that harshly restrict nonprofit organizations.,human rights for refugees,government donors
2018-03-22 18:03:20,2018-03-22 18:06:30,IP Address,76.189.238.99,100,190,True,2018-03-22 18:06:31,R_3NBVBHE44sWbY0E,,,,,40.440994262695,-81.491996765137,anonymous,EN,Yes,"Green,Yellow",Very favorable,Very favorable,Favorable,Extremely unlikely,0,100,"I don't know how they use the money, and I donate to other causes.",Once a week,Yes,Only now and then,Conservative,4 year degree,More than once a week,Blue,Female,,"$50,000 – $59,999",45 – 54,5395142,.,human rights for refugees,government donors
2018-03-22 18:06:19,2018-03-22 18:09:12,IP Address,174.32.160.147,100,173,True,2018-03-22 18:09:13,R_1DnTZyag6lXABsJ,,,,,30.450698852539,-91.154602050781,anonymous,EN,Yes,"Green,Yellow",Very favorable,Favorable,Very favorable,Somewhat likely,20,80,"I don't know very much about this charity, so I wouldn't donate very much at first without research. ",Once a year,Yes,Most of the time,Liberal,4 year degree,Never,Blue,Female,,"$30,000 – $39,999",35 – 44,973029,.,humanitarian assistance for refugees,government donors
2018-03-22 18:02:43,2018-03-22 18:10:03,IP Address,74.105.107.216,100,440,True,2018-03-22 18:10:04,R_1In20HAruiOZHpC,,,,,40.003997802734,-74.225799560547,anonymous,EN,Yes,"Green,Yellow",Favorable,Favorable,Favorable,Neither likely nor unlikely,1,99,It was stated that it received donations from government donors which I don't think I am so if I donated it would be low.,Once every few years,Yes,Most of the time,Independent,2 year degree,More than once a week,Blue,Male,,Prefer not to say,35 – 44,4427761,&nbsp;and works in countries that have recently passed laws that harshly restrict nonprofit organizations.,humanitarian assistance for refugees,government donors
2018-03-22 18:07:18,2018-03-22 18:10:32,IP Address,66.225.251.58,100,194,True,2018-03-22 18:10:33,R_2PuLNWVAGYAzo85,,,,,37.103500366211,-80.420700073242,anonymous,EN,Yes,"Green,Yellow",Very favorable,Very favorable,Very favorable,Extremely unlikely,2,98,I would give to local organizations that help alleviate poverty and hunger.,Once every three months,Yes,Most of the time,"Independent, leaning liberal",Doctorate,Never,Yellow,Male,,"$100,000 – $149,999",45 – 54,2399000,&nbsp;and works in countries that have recently passed laws that harshly restrict nonprofit organizations.,human rights for refugees,"individual, private donors"
2018-03-22 18:10:31,2018-03-22 18:12:35,IP Address,24.105.167.66,100,123,True,2018-03-22 18:12:35,R_rouupzrv89E3TYR,,,,,42.970306396484,-72.279998779297,anonymous,EN,Yes,"Green,Yellow",Favorable,Favorable,Favorable,Somewhat unlikely,0,100,"There are other organizations that are more important in my life to donate to. ",Once a month,Yes,Most of the time,"Independent, leaning conservative",2 year degree,A few times a year,Blue,Female,,"$100,000 – $149,999",55 – 64,1547775,&nbsp;and works in countries that have recently passed laws that harshly restrict nonprofit organizations.,humanitarian assistance for refugees,"individual, private donors"
2018-03-22 18:11:28,2018-03-22 18:14:09,IP Address,23.117.142.103,100,160,True,2018-03-22 18:14:10,R_1Q6GeqnhZRTPoBm,,,,,37.645401000977,-95.462997436523,anonymous,EN,Yes,"Green,Yellow",Very favorable,Very favorable,Very favorable,Somewhat likely,39,61,I need more information before I would donate more.,Once a year,No,Some of the time,"Independent, leaning conservative",4 year degree,Once or twice a month,Blue,Female,,"$40,000 – $49,999",55 – 64,2592959,.,humanitarian assistance for refugees,"individual, private donors"
2018-03-22 18:13:37,2018-03-22 18:16:31,IP Address,63.150.133.209,100,174,True,2018-03-22 18:16:32,R_1pQzEaids0SVXwc,,,,,46.085693359375,-115.86280059814,anonymous,EN,Yes,"Green,Yellow",Very favorable,Very favorable,Very favorable,Neither likely nor unlikely,100,0,"I don't need the money as badly as others might. ",Once every three months,No,Some of the time,Strong liberal,High school graduate,Never,Blue,Female,,"$50,000 – $59,999",25 – 34,41853,&nbsp;and works in countries that have recently passed laws that harshly restrict nonprofit organizations.,human rights for refugees,government donors
2018-03-22 18:17:55,2018-03-22 18:19:50,IP Address,66.91.2.230,100,114,True,2018-03-22 18:19:50,R_1gpfj4EdT52FkJp,,,,,19.460098266602,-155.02459716797,anonymous,EN,Yes,"Green,Yellow",Very favorable,Very favorable,Very favorable,Neither likely nor unlikely,10,90,"I am in need of money at the moment, trying to survive life myself. If i had expendable income I would definitely donate to this",Once every few years,No,Most of the time,"Independent, leaning liberal",Some college,Never,Blue,Male,,"$20,000 – $29,999",25 – 34,2690260,.,human rights for refugees,"individual, private donors"
2018-03-22 18:02:27,2018-03-22 18:19:50,IP Address,107.10.194.24,100,1042,True,2018-03-22 18:19:52,R_2DOKy3AFjwme6JK,,,,,41.474899291992,-81.738800048828,anonymous,EN,Yes,"Green,Yellow",Very favorable,Very favorable,Very favorable,Neither likely nor unlikely,10,90,Low donation due to the extra $100 will current my bills.,Once a year,Yes,Some of the time,Liberal,Some college,Once a week,Blue,Female,,"$10,000 – $19,999",65 – 74,903353,.,human rights for refugees,"individual, private donors"
2018-03-22 18:18:34,2018-03-22 18:20:50,IP Address,73.5.13.237,100,136,True,2018-03-22 18:20:50,R_3ksKRafuMj41BXG,,,,,32.432601928711,-90.155601501465,anonymous,EN,Yes,"Green,Yellow",Very favorable,Favorable,Favorable,Somewhat unlikely,0,100,I dont know enough about this organization,Once a week,No,Most of the time,"Independent, leaning liberal",4 year degree,Never,Blue,Male,,"$100,000 – $149,999",35 – 44,3260137,&nbsp;and works in countries that have recently passed laws that harshly restrict nonprofit organizations.,humanitarian assistance for refugees,"individual, private donors"
2018-03-22 18:19:48,2018-03-22 18:21:26,IP Address,107.77.219.91,100,98,True,2018-03-22 18:21:27,R_1KwoRpi0PSYCD4M,,,,,32.778701782227,-96.821701049805,anonymous,EN,Yes,"Green,Yellow",Favorable,Favorable,Neutral,Somewhat unlikely,5,95,honeslty because i need the money,Once a year,Yes,Only now and then,Conservative,2 year degree,Once a week,Blue,Female,,"$50,000 – $59,999",25 – 34,9779381,&nbsp;and works in countries that have recently passed laws that harshly restrict nonprofit organizations.,humanitarian assistance for refugees,government donors
2018-03-22 18:21:15,2018-03-22 18:23:59,IP Address,68.117.193.180,100,163,True,2018-03-22 18:23:59,R_2ErQucctz2bak0w,,,,,34.009094238281,-84.008796691895,anonymous,EN,Yes,"Green,Yellow",Favorable,Favorable,Favorable,Neither likely nor unlikely,20,80,I think it is a fair amount,Once every three months,Yes,Some of the time,Independent,2 year degree,Seldom,Blue,Female,,"$30,000 – $39,999",25 – 34,2707924,.,human rights for refugees,government donors
2018-03-22 18:22:53,2018-03-22 18:25:52,IP Address,173.254.194.196,100,179,True,2018-03-22 18:25:53,R_3hGfwLxvVNcOUUA,,,,,34.043792724609,-118.25120544434,anonymous,EN,Yes,"Green,Yellow",Very favorable,Very favorable,Very favorable,Extremely likely,9,91,want to be part of the nonprofit organization with similar views like mine.,Once a week,No,Some of the time,Independent,4 year degree,Once a week,Blue,Male,,"$50,000 – $59,999",45 – 54,4099135,&nbsp;and works in countries that have recently passed laws that harshly restrict nonprofit organizations.,human rights for refugees,"individual, private donors"
2018-03-22 18:24:30,2018-03-22 18:26:26,IP Address,24.145.80.72,100,116,True,2018-03-22 18:26:26,R_1r8RSimwniMGFH5,,,,,33.448303222656,-81.692100524902,anonymous,EN,Yes,"Green,Yellow",Favorable,Favorable,Neutral,Somewhat unlikely,0,100,i'm not in favor of IRC,Once every few years,No,Only now and then,"Independent, leaning conservative",4 year degree,Seldom,Blue,Female,,"$70,000 – $79,999",25 – 34,6442244,.,humanitarian assistance for refugees,government donors
2018-03-22 18:23:53,2018-03-22 18:26:35,IP Address,73.233.158.181,100,162,True,2018-03-22 18:26:36,R_1j84iTggshAxSwE,,,,,40.260498046875,-75.615501403809,anonymous,EN,Yes,"Green,Yellow",Favorable,Favorable,Favorable,Neither likely nor unlikely,8,92,I normally donate 10 percent.,Once every three months,Yes,Most of the time,Liberal,2 year degree,A few times a year,Blue,Female,,"$90,000 – $99,999",45 – 54,6371084,&nbsp;and works in countries that have recently passed laws that harshly restrict nonprofit organizations.,human rights for refugees,government donors
2018-03-22 18:27:42,2018-03-22 18:31:14,IP Address,172.250.200.127,100,212,True,2018-03-22 18:31:15,R_3EsSLnsJrC6SIIL,,,,,33.740097045898,-117.81959533691,anonymous,EN,Yes,Red,Favorable,Favorable,Favorable,Neither likely nor unlikely,25,75,"THERE ALOT I CAN DO WITH AN EXTRA $100, LIKE PAY BILLS",Once every few years,No,Most of the time,"Independent, leaning liberal",2 year degree,Seldom,Blue,Female,,"$20,000 – $29,999",35 – 44,1995611,.,humanitarian assistance for refugees,"individual, private donors"
2018-03-22 18:29:21,2018-03-22 18:31:44,IP Address,71.236.213.96,100,143,True,2018-03-22 18:31:45,R_XuNF14SRBUQZIeR,,,,,45.476303100586,-122.64080047607,anonymous,EN,Yes,"Green,Yellow",Favorable,Neutral,Favorable,Somewhat unlikely,8,92,only what I can afford,Once every few years,No,Most of the time,Conservative,High school graduate,A few times a year,Blue,Male,,"$10,000 – $19,999",55 – 64,4348225,&nbsp;and works in countries that have recently passed laws that harshly restrict nonprofit organizations.,human rights for refugees,"individual, private donors"
2018-03-22 18:31:09,2018-03-22 18:33:25,IP Address,216.9.29.131,100,135,True,2018-03-22 18:33:25,R_1nUY8qgT6wJEUq3,,,,,47.559494018555,-122.0092010498,anonymous,EN,Yes,"Green,Yellow",Favorable,Favorable,Favorable,Somewhat likely,10,90,"Not familiar with them so don’t want to give too much. ",Once every six months,No,Most of the time,Liberal,4 year degree,Seldom,Blue,Female,,"$70,000 – $79,999",35 – 44,4703634,.,human rights for refugees,government donors
2018-03-22 18:34:01,2018-03-22 18:35:47,IP Address,71.201.227.109,100,106,True,2018-03-22 18:35:48,R_1Fyz4ebUVQrHFjT,,,,,41.930999755859,-88.009002685547,anonymous,EN,Yes,"Green,Yellow",Very favorable,Very favorable,Favorable,Somewhat unlikely,3,97,"Their mission doesn't match my primary targets for charitable giving (literacy and women's rights), but if it were convenient I'd put a couple of dollars in a donation box.",Once every six months,No,Most of the time,Strong liberal,4 year degree,Never,Blue,Female,,"$10,000 – $19,999",25 – 34,964031,&nbsp;and works in countries that have recently passed laws that harshly restrict nonprofit organizations.,humanitarian assistance for refugees,government donors
2018-03-22 18:33:22,2018-03-22 18:36:15,IP Address,73.64.96.106,100,172,True,2018-03-22 18:36:15,R_2tmMrYbGp6YyMOD,,,,,41.429092407227,-75.594596862793,anonymous,EN,Yes,"Green,Yellow",Favorable,Favorable,Favorable,Neither likely nor unlikely,0,100,i'm not that familiar with the organization and they receive funding from the government.  i would need more information before donating to an organization like this,Once every six months,No,Some of the time,Liberal,Some college,Seldom,Blue,Female,,"$100,000 – $149,999",45 – 54,8550648,&nbsp;and works in countries that have recently passed laws that harshly restrict nonprofit organizations.,human rights for refugees,government donors
