StartDate,EndDate,Status,IPAddress,Progress,Duration (in seconds),Finished,RecordedDate,ResponseId,RecipientLastName,RecipientFirstName,RecipientEmail,ExternalReference,LocationLatitude,LocationLongitude,DistributionChannel,UserLanguage,Q1.2,Q1.3,Q2.1_1,Q2.1_2,Q2.1_3,Q2.3,Q2.4_1,Q2.4_2,Q2.5,Q3.2,Q3.3,Q3.4,Q3.5,Q3.6,Q3.7,Q3.8,Q3.9,Q3.9_4_TEXT,Q3.10,Q3.11,mTurkCode,crackdown,issue,funding
2018-03-22 21:06:54,2018-03-22 21:11:56,IP Address,70.160.72.183,100,301,True,2018-03-22 21:11:56,R_2qq4FrlF9dEy3xJ,,,,,36.90950012207,-76.18579864502,anonymous,EN,Yes,"Green,Yellow",Very favorable,Neutral,Favorable,Somewhat likely,18,82,It seems to be a good cause and that is why I would donate $18.00. I think refugees should be helped especially the children. War and disasters can be cruel and they need all the help they can get.  The rest of that amount is to keep and enjoy.,Once a week,No,Most of the time,"Independent, leaning conservative",Some college,Once a week,Blue,Male,,"$30,000 – $39,999",55 – 64,2533053,.,humanitarian assistance for refugees,"individual, private donors"
2018-03-22 21:16:49,2018-03-22 21:20:27,IP Address,73.79.233.47,100,218,True,2018-03-22 21:20:28,R_1MY9cZsq22YslJ2,,,,,40.391494750977,-76.438102722168,anonymous,EN,Yes,"Green,Yellow",Neutral,Favorable,Favorable,Somewhat likely,20,80,"Because it’s not about the amount given it’s about what was given ",Once a year,No,Only now and then,Liberal,High school graduate,Seldom,Blue,Female,,"$40,000 – $49,999",25 – 34,4177579,&nbsp;and works in countries that have recently passed laws that harshly restrict nonprofit organizations.,humanitarian assistance for refugees,government donors
2018-03-22 21:19:01,2018-03-22 21:21:05,IP Address,96.58.56.235,100,124,True,2018-03-22 21:21:05,R_2ClGXiy9tMvgr5L,,,,,28.205902099609,-82.320098876953,anonymous,EN,Yes,"Green,Yellow",Very favorable,Very favorable,Very favorable,Somewhat unlikely,0,100,"I am very poor and live paycheck to paycheck. This organization receives money from government donors, so it is likely well funded, so I would rather eat today than donate money.",Once every six months,No,Some of the time,Liberal,Graduate or professional degree,Seldom,Blue,Male,,"$20,000 – $29,999",35 – 44,2867555,.,humanitarian assistance for refugees,government donors
2018-03-22 21:20:09,2018-03-22 21:21:49,IP Address,50.125.85.19,100,99,True,2018-03-22 21:21:50,R_2uJoYSFkA2GVvx0,,,,,47.804901123047,-122.28329467773,anonymous,EN,Yes,"Green,Yellow",Very favorable,Very favorable,Very favorable,Somewhat likely,100,0,I like to donate in even amounts of 100.,Once a month,Yes,Most of the time,Liberal,Graduate or professional degree,Never,Blue,Male,,"$100,000 – $149,999",55 – 64,2675458,&nbsp;and works in countries that have recently passed laws that harshly restrict nonprofit organizations.,human rights for refugees,"individual, private donors"
2018-03-22 21:19:32,2018-03-22 21:21:56,IP Address,100.36.29.170,100,143,True,2018-03-22 21:21:56,R_3Hq2b6TqtvRBcQk,,,,,38.931106567383,-77.348899841309,anonymous,EN,Yes,"Green,Yellow",Unfavorable,Neutral,Neutral,Neither likely nor unlikely,20,80,i do not typically donate in general,Once a year,Yes,Some of the time,Liberal,4 year degree,Never,Blue,Male,,"More than $150,000",18 – 24,2542974,&nbsp;and works in countries that have recently passed laws that harshly restrict nonprofit organizations.,human rights for refugees,government donors
2018-03-22 21:16:20,2018-03-22 21:22:50,IP Address,76.115.242.16,100,390,True,2018-03-22 21:22:51,R_12r26mTe8pgrfd2,,,,,44.048599243164,-123.21969604492,anonymous,EN,Yes,"Green,Yellow",Very favorable,Favorable,Very favorable,Neither likely nor unlikely,10,90,10% is an appropriate portion of income to donate to charity.,Once a week,No,Most of the time,Liberal,Some college,Never,Blue,Male,,"$70,000 – $79,999",55 – 64,8238924,.,humanitarian assistance for refugees,"individual, private donors"
2018-03-22 21:21:58,2018-03-22 21:23:18,IP Address,65.50.79.50,100,79,True,2018-03-22 21:23:18,R_1r1aokmWZzPhQ6s,,,,,33.416793823242,-86.680099487305,anonymous,EN,Yes,"Green,Yellow",Very favorable,Very favorable,Very favorable,Extremely likely,50,50,So that I could help others but also put some money aside.,Once a year,Yes,Most of the time,Strong liberal,Graduate or professional degree,A few times a year,Blue,Female,,"$30,000 – $39,999",25 – 34,6765152,.,human rights for refugees,"individual, private donors"
2018-03-22 21:28:22,2018-03-22 21:31:58,IP Address,124.121.24.230,100,216,True,2018-03-22 21:31:59,R_1mdZ1k0FFFnOqbR,,,,,13.699996948242,100.46670532227,anonymous,EN,Yes,"Green,Yellow",Very favorable,Very favorable,Very favorable,Neither likely nor unlikely,30,70,so I could keep for other projects.,Once a year,Yes,Some of the time,Liberal,4 year degree,A few times a year,Blue,Female,,"$100,000 – $149,999",35 – 44,867222,&nbsp;and works in countries that have recently passed laws that harshly restrict nonprofit organizations.,humanitarian assistance for refugees,"individual, private donors"
2018-03-22 21:29:09,2018-03-22 21:32:22,IP Address,99.93.197.185,100,192,True,2018-03-22 21:32:23,R_3kA2vvhShJJuMBS,,,,,42.052505493164,-87.890602111816,anonymous,EN,Yes,"Green,Yellow",Very favorable,Very favorable,Very favorable,Somewhat likely,25,75,"I would want to do the right thing ",Once a year,No,Most of the time,Liberal,4 year degree,Never,Blue,Male,,"$60,000 – $69,999",45 – 54,9526638,&nbsp;and works in countries that have recently passed laws that harshly restrict nonprofit organizations.,human rights for refugees,"individual, private donors"
2018-03-22 21:29:45,2018-03-22 21:32:43,IP Address,71.38.36.55,100,178,True,2018-03-22 21:32:43,R_qIrGTF2ocWWCPPb,,,,,36.214294433594,-115.21309661865,anonymous,EN,Yes,"Green,Yellow",Favorable,Favorable,Favorable,Neither likely nor unlikely,10,90,I would like to know more about the committee before I pledge more,Once every three months,Yes,Most of the time,Liberal,4 year degree,Never,Blue,Female,,"$60,000 – $69,999",45 – 54,6077340,.,humanitarian assistance for refugees,government donors
2018-03-22 21:32:15,2018-03-22 21:34:20,IP Address,73.220.75.210,100,125,True,2018-03-22 21:34:21,R_2qb0TSUq9Mkij5Y,,,,,38.784301757812,-121.37060546875,anonymous,EN,Yes,"Green,Yellow",Very favorable,Very favorable,Very favorable,Somewhat likely,100,0,"If I had extra, then it makes sense to donate it all",Once a month,Yes,Most of the time,Liberal,Graduate or professional degree,Seldom,Blue,Male,,"More than $150,000",35 – 44,3232853,&nbsp;and works in countries that have recently passed laws that harshly restrict nonprofit organizations.,humanitarian assistance for refugees,government donors
2018-03-22 21:32:44,2018-03-22 21:34:51,IP Address,68.15.203.179,100,126,True,2018-03-22 21:34:51,R_roGFF7xu4nMRW49,,,,,35.483505249023,-97.653999328613,anonymous,EN,Yes,"Green,Yellow",Favorable,Favorable,Favorable,Somewhat unlikely,0,100,I would have to do research on a charitable organisation before donating to it.,Once a year,Yes,Most of the time,Strong liberal,4 year degree,Never,Blue,Female,,"$60,000 – $69,999",25 – 34,248931,.,human rights for refugees,"individual, private donors"
2018-03-22 21:35:17,2018-03-22 21:41:03,IP Address,72.131.104.139,100,345,True,2018-03-22 21:41:04,R_SMEtZ2kJy4Jm0A9,,,,,44.390594482422,-88.03099822998,anonymous,EN,Yes,"Green,Yellow",Favorable,Favorable,Favorable,Neither likely nor unlikely,10,90,"While I don't mind donating some, I could really use the extra money myself.",Once every six months,No,Some of the time,"Independent, leaning liberal",4 year degree,Never,Blue,Male,,"$50,000 – $59,999",55 – 64,7759854,&nbsp;and works in countries that have recently passed laws that harshly restrict nonprofit organizations.,humanitarian assistance for refugees,"individual, private donors"
2018-03-22 21:38:38,2018-03-22 21:41:57,IP Address,24.5.113.154,100,199,True,2018-03-22 21:41:57,R_3KPcSivRmavdydb,,,,,36.624893188477,-121.82569885254,anonymous,EN,Yes,"Green,Yellow",Very favorable,Very favorable,Very favorable,Neither likely nor unlikely,0,100,I do a lot of research into organizations prior to donating money to them.  I want to make sure they're spending their money wisely to benefit people.,Once every three months,Yes,Some of the time,Independent,4 year degree,Never,Blue,Female,,"$50,000 – $59,999",35 – 44,851378,.,humanitarian assistance for refugees,"individual, private donors"
2018-03-22 21:39:15,2018-03-22 21:42:09,IP Address,70.161.95.15,100,174,True,2018-03-22 21:42:10,R_Y5NRW653xF6Ce1r,,,,,36.802093505859,-76.275398254395,anonymous,EN,Yes,"Green,Yellow",Very favorable,Very favorable,Very favorable,Neither likely nor unlikely,25,75,I have other organizations that help the poor.,Once every six months,No,Most of the time,Conservative,Graduate or professional degree,More than once a week,Blue,Male,,"$30,000 – $39,999",55 – 64,221010,&nbsp;and works in countries that have recently passed laws that harshly restrict nonprofit organizations.,human rights for refugees,government donors
2018-03-22 21:40:46,2018-03-22 21:43:17,IP Address,24.26.17.205,100,150,True,2018-03-22 21:43:18,R_2bIYS3SGvmlfRNJ,,,,,37.622192382812,-87.108299255371,anonymous,EN,Yes,"Green,Yellow",Favorable,Favorable,Favorable,Somewhat likely,100,0,They obviously need it more than I do.,Once a year,No,Most of the time,Very conservative,Some college,Once a week,Blue,Female,,"$50,000 – $59,999",35 – 44,3510738,&nbsp;and works in countries that have recently passed laws that harshly restrict nonprofit organizations.,human rights for refugees,"individual, private donors"
2018-03-22 21:41:37,2018-03-22 21:45:04,IP Address,76.176.74.194,100,206,True,2018-03-22 21:45:04,R_0ffSKfPTlPWZEjf,,,,,32.965606689453,-117.12699890137,anonymous,EN,Yes,"Green,Yellow",Favorable,Favorable,Favorable,Neither likely nor unlikely,20,80,Since I am on a limited income I need the additional money for my bills.,Once every few years,No,Some of the time,"Independent, leaning liberal",Some college,Never,Blue,Male,,"Less than $10,000",45 – 54,7553669,.,humanitarian assistance for refugees,government donors
2018-03-22 21:43:36,2018-03-22 21:46:23,IP Address,97.123.4.121,100,166,True,2018-03-22 21:46:23,R_6rFHn4Q9bU40E9j,,,,,35.084503173828,-106.65110015869,anonymous,EN,Yes,"Green,Yellow",Favorable,Favorable,Favorable,Neither likely nor unlikely,0,100,I don't know enough about this organization and would have to know more about their efforts before donating.,Once a month,No,Most of the time,Independent,Graduate or professional degree,Never,Blue,Male,,"$100,000 – $149,999",45 – 54,2742336,&nbsp;and works in countries that have recently passed laws that harshly restrict nonprofit organizations.,humanitarian assistance for refugees,"individual, private donors"
2018-03-22 21:38:52,2018-03-22 21:46:27,IP Address,70.173.37.239,100,454,True,2018-03-22 21:46:28,R_9ZBBj97dB1Ojsbv,,,,,36.198196411133,-115.31050109863,anonymous,EN,Yes,"Green,Yellow",Favorable,Very favorable,Favorable,Somewhat likely,50,50,I would like to contribute a substantial amount of money to the worthy cause of helping people in dire situations.,Once every six months,Yes,Most of the time,Independent,4 year degree,Once or twice a month,Blue,Male,,"$90,000 – $99,999",35 – 44,1739678,.,human rights for refugees,government donors
2018-03-22 21:44:31,2018-03-22 21:49:16,IP Address,68.62.148.123,100,284,True,2018-03-22 21:49:16,R_3HiylD86wvLcc3B,,,,,33.332305908203,-87.474098205566,anonymous,EN,Yes,"Green,Yellow",Favorable,Favorable,Favorable,Somewhat unlikely,10,90,"I wouldn't trust the money is actually going to help those in need and not to upper-executives within the organization, so I would not donate much.  ",Once every six months,Yes,Most of the time,"Independent, leaning conservative",Graduate or professional degree,Never,Blue,Male,,"$100,000 – $149,999",25 – 34,8051760,&nbsp;and works in countries that have recently passed laws that harshly restrict nonprofit organizations.,humanitarian assistance for refugees,government donors
2018-03-22 21:48:54,2018-03-22 21:50:48,IP Address,66.25.50.30,100,114,True,2018-03-22 21:50:48,R_50Ur88SNIwsH0it,,,,,32.861999511719,-96.592597961426,anonymous,EN,Yes,"Green,Yellow",Very favorable,Very favorable,Very favorable,Somewhat likely,15,85,"I support the cause, so I'd give a little bit. I see that a large portion of it's funding comes from government donors though, so I feel like it doesn't need me as much.",Once every six months,No,Some of the time,Liberal,4 year degree,Never,Blue,Female,,"$30,000 – $39,999",25 – 34,6186528,&nbsp;and works in countries that have recently passed laws that harshly restrict nonprofit organizations.,human rights for refugees,government donors
2018-03-22 21:49:10,2018-03-22 21:51:04,IP Address,73.161.2.56,100,113,True,2018-03-22 21:51:05,R_33jyP9vnYfPo3ce,,,,,43.794403076172,-83.002502441406,anonymous,EN,Yes,"Green,Yellow",Neutral,Favorable,Neutral,Neither likely nor unlikely,1,99,because that is all i would donate,Once every few years,No,Hardly at all,Independent,High school graduate,Seldom,Blue,Male,,"Less than $10,000",35 – 44,2903153,.,human rights for refugees,"individual, private donors"
2018-03-22 21:49:32,2018-03-22 21:51:56,IP Address,69.143.176.79,100,143,True,2018-03-22 21:51:56,R_2fAJ1eVcSWp3luJ,,,,,38.860000610352,-77.053298950195,anonymous,EN,Yes,"Green,Yellow",Favorable,Favorable,Favorable,Somewhat likely,0,100,"I am currently unemployed and so I should save the money for myself. ",Once every three months,Yes,Some of the time,"Independent, leaning liberal",4 year degree,Never,Blue,Female,,"$100,000 – $149,999",35 – 44,6776937,.,humanitarian assistance for refugees,"individual, private donors"
2018-03-22 21:50:05,2018-03-22 21:52:35,IP Address,98.21.222.52,100,149,True,2018-03-22 21:52:35,R_1fZW3wtvw0WFH89,,,,,40.124099731445,-82.382797241211,anonymous,EN,Yes,"Green,Yellow",Favorable,Favorable,Favorable,Somewhat likely,0,100,"I do not know anything about the IRC at this time. ",Once every three months,Yes,Most of the time,Conservative,Some college,Seldom,Blue,Female,,"$50,000 – $59,999",35 – 44,4647704,.,humanitarian assistance for refugees,"individual, private donors"
2018-03-22 21:48:25,2018-03-22 21:52:43,IP Address,70.173.37.239,100,257,True,2018-03-22 21:52:43,R_22RmmtFimETZh8f,,,,,36.198196411133,-115.31050109863,anonymous,EN,Yes,"Green,Yellow",Very favorable,Favorable,Favorable,Extremely likely,100,0,It is quintessential to do everything possible to protect human rights all around the world.,Once every three months,Yes,Most of the time,Liberal,4 year degree,Once a week,Blue,Female,,"$90,000 – $99,999",35 – 44,7785770,.,human rights for refugees,government donors
2018-03-22 21:53:39,2018-03-22 21:55:48,IP Address,24.160.45.186,100,128,True,2018-03-22 21:55:49,R_1EgnXUgl1J0wuTn,,,,,47.789199829102,-117.02659606934,anonymous,EN,Yes,"Green,Yellow",Favorable,Favorable,Favorable,Neither likely nor unlikely,0,100,I don't really know anything about IRC so I could not commit to donating right now.,Once every six months,No,Most of the time,Liberal,4 year degree,Never,Blue,Female,,"$90,000 – $99,999",35 – 44,5228426,&nbsp;and works in countries that have recently passed laws that harshly restrict nonprofit organizations.,human rights for refugees,"individual, private donors"
2018-03-22 21:53:44,2018-03-22 21:57:48,IP Address,52.119.23.127,100,243,True,2018-03-22 21:57:49,R_2R7wO7hRZ2V1wau,,,,,33.623794555664,-112.00399780273,anonymous,EN,Yes,"Green,Yellow",Favorable,Favorable,Favorable,Neither likely nor unlikely,0,100,"I generally donate locally, I fell I can have a more direct impact.",Once every six months,Yes,Some of the time,"Independent, leaning conservative",4 year degree,A few times a year,Blue,Male,,"$50,000 – $59,999",45 – 54,6011778,.,humanitarian assistance for refugees,government donors
2018-03-22 21:54:46,2018-03-22 21:57:56,IP Address,173.26.102.33,100,190,True,2018-03-22 21:57:57,R_unairOWvjWt3fqx,,,,,37.299896240234,-93.308403015137,anonymous,EN,Yes,"Green,Yellow",Favorable,Very favorable,Very favorable,Somewhat likely,25,75,"I am so broke and behind on bills or i would donate more. ",Once a month,No,Hardly at all,Independent,High school graduate,Once or twice a month,Blue,Female,,"Less than $10,000",25 – 34,4170549,.,human rights for refugees,government donors
2018-03-22 21:57:07,2018-03-22 21:59:46,IP Address,74.97.26.167,100,159,True,2018-03-22 21:59:47,R_2tbdMeROFN49VV6,,,,,41.796401977539,-71.425399780273,anonymous,EN,Yes,"Green,Yellow",Very favorable,Very favorable,Very favorable,Somewhat likely,10,90,"I don;t know enough about the organization to give more.  If I knew more about them, I'd probably give more.",Once a month,Yes,Most of the time,Liberal,4 year degree,Never,Blue,Female,,"$100,000 – $149,999",35 – 44,8916826,&nbsp;and works in countries that have recently passed laws that harshly restrict nonprofit organizations.,humanitarian assistance for refugees,government donors
2018-03-22 21:58:03,2018-03-22 22:00:35,IP Address,24.5.191.108,100,151,True,2018-03-22 22:00:35,R_qJD0YvQHZQBxarD,,,,,37.554992675781,-122.268699646,anonymous,EN,Yes,"Green,Yellow",Very favorable,Very favorable,Very favorable,Somewhat likely,10,90,"I'm kinda broke at the moment. If I wasn't as strapped, I would donate more. This charity deserves help.",Once a year,No,Some of the time,Liberal,Less than high school,Never,Blue,Male,,"$100,000 – $149,999",25 – 34,5521700,&nbsp;and works in countries that have recently passed laws that harshly restrict nonprofit organizations.,humanitarian assistance for refugees,"individual, private donors"
2018-03-22 21:58:36,2018-03-22 22:00:54,IP Address,75.70.6.153,100,137,True,2018-03-22 22:00:54,R_3QLtsGjC6JeiomB,,,,,38.762893676758,-104.84790039062,anonymous,EN,Yes,"Green,Yellow",Favorable,Favorable,Favorable,Neither likely nor unlikely,20,80,I am broke! :(,Once every few years,Yes,Most of the time,"Independent, leaning liberal",Some college,Seldom,Blue,Female,,"$20,000 – $29,999",35 – 44,8063244,&nbsp;and works in countries that have recently passed laws that harshly restrict nonprofit organizations.,human rights for refugees,government donors
2018-03-22 21:59:13,2018-03-22 22:03:09,IP Address,73.222.232.163,100,236,True,2018-03-22 22:03:10,R_1OACDxWzlTEGRqb,,,,,37.674499511719,-122.0883026123,anonymous,EN,Yes,"Green,Yellow",Very favorable,Very favorable,Very favorable,Neither likely nor unlikely,10,90,"Not very familiar with the organization.  ",Once every six months,No,Most of the time,Conservative,4 year degree,Seldom,Blue,Male,,"$100,000 – $149,999",45 – 54,7083209,.,human rights for refugees,"individual, private donors"
2018-03-22 22:02:51,2018-03-22 22:04:14,IP Address,152.17.119.46,100,83,True,2018-03-22 22:04:15,R_25F3HOzxSR3jWlA,,,,,36.086395263672,-80.263603210449,anonymous,EN,Yes,"Green,Yellow",Very favorable,Very favorable,Very favorable,Somewhat likely,19,81,"I need money myself because I am poor, but I want to help.",Never,Yes,Most of the time,Strong liberal,4 year degree,Never,Blue,Female,,"Less than $10,000",18 – 24,3921292,&nbsp;and works in countries that have recently passed laws that harshly restrict nonprofit organizations.,humanitarian assistance for refugees,government donors
2018-03-22 22:01:35,2018-03-22 22:04:24,IP Address,67.77.144.69,100,168,True,2018-03-22 22:04:24,R_1mI8niMdv8ADxxL,,,,,36.120101928711,-115.08769989014,anonymous,EN,Yes,"Green,Yellow",Very favorable,Very favorable,Very favorable,Somewhat likely,20,80,"I believe in giving a tithe. If it is a good cause, I am willing to donate a little more.",Once a month,Yes,Only now and then,Conservative,4 year degree,Once a week,Blue,Female,,"$60,000 – $69,999",25 – 34,5709080,&nbsp;and works in countries that have recently passed laws that harshly restrict nonprofit organizations.,human rights for refugees,"individual, private donors"
2018-03-22 22:03:31,2018-03-22 22:05:40,IP Address,73.169.160.144,100,128,True,2018-03-22 22:05:40,R_1jKb2ANl8uMs78d,,,,,47.694305419922,-117.45399475098,anonymous,EN,Yes,"Green,Yellow",Favorable,Favorable,Favorable,Somewhat unlikely,0,100,I have other causes I would rather donate to.,Once every three months,Yes,Most of the time,Independent,4 year degree,Never,Blue,Female,,"$60,000 – $69,999",25 – 34,2893374,&nbsp;and works in countries that have recently passed laws that harshly restrict nonprofit organizations.,humanitarian assistance for refugees,"individual, private donors"
2018-03-22 22:05:53,2018-03-22 22:07:03,IP Address,59.97.52.39,100,69,True,2018-03-22 22:07:03,R_1NCXVwrScsmeC5z,,,,,10.350006103516,77.950012207031,anonymous,EN,Yes,White,Neutral,Favorable,Unfavorable,Extremely likely,31,69,100,Once a month,Yes,Some of the time,"Independent, leaning liberal",High school graduate,Once a week,Red,Female,,"More than $150,000",25 – 34,5857679,.,human rights for refugees,"individual, private donors"
2018-03-22 22:05:42,2018-03-22 22:07:32,IP Address,173.19.190.139,100,109,True,2018-03-22 22:07:32,R_3JIWkFA1CdROztC,,,,,41.988204956055,-91.75350189209,anonymous,EN,Yes,"Green,Yellow",Unfavorable,Very unfavorable,Very unfavorable,Extremely unlikely,0,100,I do not support flooding the West with refugees.,Once every few years,No,Most of the time,Independent,4 year degree,Never,Blue,Female,,"$50,000 – $59,999",55 – 64,5353592,.,human rights for refugees,"individual, private donors"
2018-03-22 22:05:31,2018-03-22 22:08:13,IP Address,107.15.151.10,100,162,True,2018-03-22 22:08:14,R_28AlEVH14khUmeu,,,,,35.887405395508,-78.750999450684,anonymous,EN,Yes,"Green,Yellow",Favorable,Favorable,Favorable,Somewhat unlikely,0,100,"Haven't heard of them before, and most of their donations come from governments",Once every three months,Yes,Some of the time,Liberal,4 year degree,A few times a year,Blue,Male,,"$80,000 – $89,999",45 – 54,6216778,.,human rights for refugees,government donors
2018-03-22 22:03:58,2018-03-22 22:11:31,IP Address,65.37.165.78,100,452,True,2018-03-22 22:11:32,R_Rf3AwsCOPpGj7LX,,,,,47.287506103516,-122.10940551758,anonymous,EN,Yes,"Green,Yellow",Very favorable,Favorable,Very favorable,Somewhat unlikely,0,100,I can think of better funds.,Once a month,Yes,Most of the time,"Independent, leaning conservative",4 year degree,Once or twice a month,Blue,Male,,"$100,000 – $149,999",45 – 54,5397394,.,humanitarian assistance for refugees,government donors
2018-03-22 22:08:31,2018-03-22 22:12:12,IP Address,172.58.67.152,100,220,True,2018-03-22 22:12:13,R_2WGZWrX8yMOhq19,,,,,35.483505249023,-97.653999328613,anonymous,EN,Yes,"Green,Yellow",Very favorable,Very favorable,Very favorable,Somewhat unlikely,21,79,I'm leery of the government backing and the Romney name.,Once every three months,No,Some of the time,Strong liberal,Some college,Never,Blue,Female,,"$10,000 – $19,999",45 – 54,9518122,&nbsp;and works in countries that have recently passed laws that harshly restrict nonprofit organizations.,human rights for refugees,government donors
2018-03-22 22:09:27,2018-03-22 22:13:43,IP Address,75.139.198.58,100,256,True,2018-03-22 22:13:43,R_3EbgzusPELmhqxj,,,,,42.28759765625,-122.90010070801,anonymous,EN,Yes,"Green,Yellow",Favorable,Neutral,Favorable,Somewhat unlikely,0,100,I would rather donate to Americans that are in dire need and there are many of them.,Once a year,No,Some of the time,Conservative,High school graduate,Never,Blue,Female,,"$30,000 – $39,999",45 – 54,1326658,.,humanitarian assistance for refugees,"individual, private donors"
2018-03-22 22:11:34,2018-03-22 22:14:07,IP Address,172.58.92.133,100,152,True,2018-03-22 22:14:07,R_3spDRpf1YWiyI81,,,,,37.748397827148,-122.4156036377,anonymous,EN,Yes,"Green,Yellow",Neutral,Favorable,Favorable,Neither likely nor unlikely,10,90,Not sure about it. So donate some money is enough.,Never,Yes,Only now and then,Liberal,Graduate or professional degree,Seldom,Blue,Female,,"$70,000 – $79,999",35 – 44,2811051,&nbsp;and works in countries that have recently passed laws that harshly restrict nonprofit organizations.,humanitarian assistance for refugees,government donors
2018-03-22 22:14:39,2018-03-22 22:16:29,IP Address,146.115.255.231,100,109,True,2018-03-22 22:16:30,R_2CfgOAkbRaisDT9,,,,,39.938201904297,-75.271896362305,anonymous,EN,Yes,"Green,Yellow",Very favorable,Very favorable,Very favorable,Somewhat likely,5,95,I would choose to donate so that I could at least donate something. I would keep that amount because I would need it in the future.,Once every three months,No,Some of the time,Strong liberal,2 year degree,Never,Blue,Male,,"$50,000 – $59,999",25 – 34,6203108,.,humanitarian assistance for refugees,"individual, private donors"
2018-03-22 22:19:00,2018-03-22 22:20:40,IP Address,76.185.105.158,100,99,True,2018-03-22 22:20:41,R_sXB6oGoJRI1d0XL,,,,,32.811996459961,-96.814300537109,anonymous,EN,Yes,"Green,Yellow",Favorable,Favorable,Unfavorable,Neither likely nor unlikely,4,96,"It's because I'm greedy and cheap. ",Once every few years,No,Only now and then,Conservative,Doctorate,Seldom,Blue,Male,,"$30,000 – $39,999",25 – 34,7161929,.,human rights for refugees,government donors
2018-03-22 22:21:23,2018-03-22 22:25:08,IP Address,98.215.138.219,100,224,True,2018-03-22 22:25:08,R_3rJsdfEQNp4xo8f,,,,,40.942092895508,-90.377998352051,anonymous,EN,Yes,"Green,Yellow",Favorable,Favorable,Favorable,Somewhat unlikely,5,95,It might be a good organization but I would have to know more about it before donating more than just a small sum.,Once every six months,No,Most of the time,Conservative,Some college,Never,Blue,Male,,"$20,000 – $29,999",65 – 74,7734201,&nbsp;and works in countries that have recently passed laws that harshly restrict nonprofit organizations.,human rights for refugees,"individual, private donors"
